### ISSUE TITLE
plugin send data and ack tcp packet after receive server's Fin packet, then send Fin back

### ISSUE THREAD

**Issue by linbo** [logstash-plugins/logstash-output-http#54]
Hi,

Our environment is simple, logstash post log to tomcat server via logstash-output-http plugin. 

logstash-output-http: 3.1.1
logstash: 5.1.2
OS: Redhat 7.2 

The details is:
1. Tomcat set keepAlivedTimeout 10s. Plugin didn't send data last for 10s, so tomcat close the connection. 
2. After received tomcat's Fin packet, plugin post log to tomcat server
3. **plugin send Fin packet back** 
4. tomcat send RST packet

```
14:32:42.895689 IP logstash.56617 > tomcat.2181: Flags [.], ack 16321, win 229, options [nop,nop,TS val 406476354 ecr 2496964319], length 0
14:32:53.226484 IP tomcat.2181 > logstash.56617: Flags [F.], seq 16321, ack 225870, win 1552, options [nop,nop,TS val 2496974650 ecr 406476354], length 0
14:32:53.230563 IP logstash.56617 > tomcat.2181: Flags [P.], seq 225870:227539, ack 16322, win 229, options [nop,nop,TS val 406486688 ecr 2496974650], length 1669
E....l@.@.O.
...
!.j.)..$g.z...............
.:~....:POST / HTTP/1.1
Content-Type: application/json
Connection: Keep-Alive
Content-Length: 1467
Host: tomcat_IP:2181
User-Agent: Manticore 0.6.0
Accept-Encoding: gzip,deflate
... data json logs ...

14:32:53.230619 IP logstash.56617 > tomcat.2181: Flags [F.], seq 227539, ack 16322, win 229, options [nop,nop,TS val 406486689 ecr 2496974650], length 0
14:32:53.230816 IP tomcat.2181 > logstash.56617: Flags [R], seq 3837575445, win 0, length 0
```

As my understanding,  tcp can send data after receive Fin packet, but it should wait for ack packet from other side.  But in this scenario, plugin send Fin immediately after post the log data.
